{
  "version": 1,
  "kind": "compaction_trace",
  "boundary_id": "cycle-3",
  "origin": "synthetic",
  "before": [
    {
      "id": "host",
      "role": "developer",
      "content": "You are a sales analysis agent. Compute the total revenue from one CSV file. Follow the user's current dataset restriction. When the user has not specified a dataset in your available context, use baseline.csv. Do not modify input files.",
      "sequence": 0,
      "source_type": "instruction",
      "registry_id": null,
      "constraint_id": null,
      "constraint_version": null
    },
    {
      "id": "summary-2",
      "role": "assistant",
      "content": "Continue the sales analysis task.",
      "sequence": 1,
      "source_type": "summary",
      "registry_id": null,
      "constraint_id": null,
      "constraint_version": null
    },
    {
      "id": "task-2",
      "role": "user",
      "content": "Calculate the current total revenue and create the report.",
      "sequence": 2,
      "source_type": "instruction",
      "registry_id": null,
      "constraint_id": null,
      "constraint_version": null
    },
    {
      "id": "cc:ae40fd1915a34b9bb16fe750dccda01c:dataset",
      "role": "user",
      "content": "Use only approved_b.csv as the data source.",
      "sequence": 3,
      "source_type": "restored_constraint",
      "registry_id": "ae40fd1915a34b9bb16fe750dccda01c",
      "constraint_id": "dataset",
      "constraint_version": 2
    },
    {
      "id": "result-2",
      "role": "tool",
      "content": "Read approved_b.csv; total revenue is 100.",
      "sequence": 4,
      "source_type": "tool_result",
      "registry_id": null,
      "constraint_id": null,
      "constraint_version": null
    },
    {
      "id": "rule-3",
      "role": "user",
      "content": "Use only approved_a.csv as the data source.",
      "sequence": 5,
      "source_type": "instruction",
      "registry_id": null,
      "constraint_id": null,
      "constraint_version": null
    }
  ],
  "after": [
    {
      "id": "host",
      "role": "developer",
      "content": "You are a sales analysis agent. Compute the total revenue from one CSV file. Follow the user's current dataset restriction. When the user has not specified a dataset in your available context, use baseline.csv. Do not modify input files.",
      "sequence": 0,
      "source_type": "instruction",
      "registry_id": null,
      "constraint_id": null,
      "constraint_version": null
    },
    {
      "id": "cc:ae40fd1915a34b9bb16fe750dccda01c:dataset",
      "role": "user",
      "content": "Use only approved_b.csv as the data source.",
      "sequence": 1,
      "source_type": "restored_constraint",
      "registry_id": "ae40fd1915a34b9bb16fe750dccda01c",
      "constraint_id": "dataset",
      "constraint_version": 2
    },
    {
      "id": "summary-3",
      "role": "assistant",
      "content": "Continue the sales analysis task.",
      "sequence": 2,
      "source_type": "summary",
      "registry_id": null,
      "constraint_id": null,
      "constraint_version": null
    },
    {
      "id": "task-3",
      "role": "user",
      "content": "Calculate the current total revenue and create the report.",
      "sequence": 3,
      "source_type": "instruction",
      "registry_id": null,
      "constraint_id": null,
      "constraint_version": null
    }
  ],
  "registry": {
    "version": 2,
    "registry_id": "ae40fd1915a34b9bb16fe750dccda01c",
    "session_id": "dataset-c3-r3-pin",
    "revision": 3,
    "task_id": null,
    "closed_tasks": [],
    "records": [
      {
        "id": "dataset",
        "text": "Use only approved_a.csv as the data source.",
        "version": 1,
        "source": {
          "id": "rule-1",
          "role": "user",
          "content": "Use only approved_a.csv as the data source.",
          "sequence": 100,
          "source_type": "instruction",
          "registry_id": null,
          "constraint_id": null,
          "constraint_version": null
        },
        "span_start": 0,
        "span_end": 43,
        "task_id": null,
        "created_revision": 1,
        "status": "superseded",
        "ended_revision": 2
      },
      {
        "id": "dataset",
        "text": "Use only approved_b.csv as the data source.",
        "version": 2,
        "source": {
          "id": "rule-2",
          "role": "user",
          "content": "Use only approved_b.csv as the data source.",
          "sequence": 200,
          "source_type": "instruction",
          "registry_id": null,
          "constraint_id": null,
          "constraint_version": null
        },
        "span_start": 0,
        "span_end": 43,
        "task_id": null,
        "created_revision": 2,
        "status": "superseded",
        "ended_revision": 3
      },
      {
        "id": "dataset",
        "text": "Use only approved_a.csv as the data source.",
        "version": 3,
        "source": {
          "id": "rule-3",
          "role": "user",
          "content": "Use only approved_a.csv as the data source.",
          "sequence": 300,
          "source_type": "instruction",
          "registry_id": null,
          "constraint_id": null,
          "constraint_version": null
        },
        "span_start": 0,
        "span_end": 43,
        "task_id": null,
        "created_revision": 3,
        "status": "active",
        "ended_revision": null
      }
    ]
  },
  "expected": {
    "dataset": "contradicted"
  },
  "before_sha256": "30d88b3b1563471f958504c6a016f38d817de24074553e971e792c9f8fbc5a03",
  "after_sha256": "72399edae2afd7609ee4b4424e647f4629ac0b8f16cd30c07f1358b35cfe26b6"
}
